[
  {
    "id": "2026-07-08-eu-001",
    "date": "2026-07-08",
    "country": "eu",
    "axis": "general",
    "change_type": "guideline_draft",
    "legal_stage": "draft_or_consultation",
    "title": "EDPB、生成AI向けのデータ匿名化およびウェブスクレイピングに関するガイドライン草案を採択",
    "summary": {
      "what": "生成AI向けのデータ匿名化およびウェブスクレイピングに関するGDPR準拠ガイドライン草案の採択",
      "who": "欧州データ保護ボード（EDPB）が、生成AI開発者やデータ管理者向けに",
      "when_impact": "2026年7月8日に公表され、同年10月30日までパブリックコンサルテーションを実施"
    },
    "detail": "欧州データ保護ボード（EDPB）は、生成AIの文脈におけるデータの匿名化およびウェブスクレイピングに関するガイドライン草案を採択しました。匿名化ガイドラインでは、データが匿名であるかを判断するための3つの基準（レコードの孤立化がないこと、リンクがないこと、推論がないこと）を提示し、コンテキストアプローチと簡易アプローチの2つのフレームワークを提供しています。ウェブスクレイピングガイドラインでは、AIトレーニングにおけるGDPR準拠（目的制限、透明性、データ最小化、適法な根拠など）について解説し、信頼できるソースからのスクレイピング、タイムスタンプの記録、データの検証を推奨しています。また、特別なカテゴリの個人データの処理は原則禁止であり、厳格な例外要件が必要であることを再確認しています。これらのガイドラインは2026年10月30日までパブリックコンサルテーションに付されます。",
    "so_what": "生成AIの学習データ収集におけるウェブスクレイピングや匿名化処理において、GDPR準拠のための具体的な判断基準や推奨策に対応する必要があります。",
    "impact": {
      "diff_changed": false,
      "diff_note": ""
    },
    "canonical_event": "EDPB adopts guidelines on anonymisation and web scraping for generative AI",
    "publication_date": "2026-07-08",
    "effective_date": null,
    "deadline_date": "2026-10-30",
    "sources": [
      "https://www.edpb.europa.eu/news/edpb-sheds-light-on-anonymisation-and-web-scraping-for-generative-ai-and-adopts-final-version_en"
    ],
    "country_anchor": "/country/eu/#axis-risk_classification"
  },
  {
    "id": "2026-07-17-eu-001",
    "date": "2026-07-17",
    "country": "eu",
    "axis": "enforcement_body",
    "change_type": "other",
    "legal_stage": "announcement",
    "title": "EDPB、規制当局間での情報共有を可能にする法的根拠の整備を欧州委員会に要請",
    "summary": {
      "what": "異なる権限を持つ規制当局間での情報共有を可能にする法的根拠の整備要請。",
      "who": "欧州データ保護会議（EDPB）",
      "when_impact": "提言段階のため、現時点で企業への直接的な影響時期は未定。"
    },
    "detail": "欧州データ保護会議（EDPB）は、AIの利用増加等に伴う苦情の複雑化に対応するため、異なる権限を持つ規制当局（データ保護当局やその他のデジタル規制当局）間で機密情報を含む情報を共有できる明確な法的根拠を提案するよう欧州委員会に求めた。これにより、規制をまたぐ効果的な協力と一貫した法執行を目指す。",
    "so_what": "今後、データ保護とAI規制の当局間で機密情報を含む情報共有が進む可能性があり、企業は複数規制を横断したガバナンス体制の構築が求められる。",
    "impact": {
      "diff_changed": false,
      "diff_note": "EU AI Act自体への直接的な変更はないが、AI法とGDPRの執行当局間の連携を強化するための法的枠組みを求めており、今後の執行体制に影響を与える可能性がある。"
    },
    "canonical_event": "EDPB calls for legal basis for cross-regulatory information sharing",
    "publication_date": "2026-07-17",
    "effective_date": null,
    "deadline_date": null,
    "sources": [
      "https://www.edpb.europa.eu/news/edpb-calls-for-legal-basis-for-cross-regulatory-information-sharing_en"
    ],
    "country_anchor": "/country/eu/#axis-enforcement_body"
  },
  {
    "id": "2026-07-21-cn-001",
    "date": "2026-07-21",
    "country": "cn",
    "axis": "general",
    "change_type": "guideline_draft",
    "legal_stage": "draft_or_consultation",
    "title": "中国TC260によるAIコード生成安全要求や未成年者保護等に関するAI安全国家標準計画およびガイドライン草案の公表",
    "summary": {
      "what": "AIコード生成安全要求等の国家標準計画下達および教育・医療向けAI安全ガイドライン草案等の意見募集",
      "who": "TC260、AIコード生成サービス事業者、教育・医療分野等でAIを提供する事業者",
      "when_impact": "2026年6月より順次策定および意見募集手続きを開始"
    },
    "detail": "2026年6月、中国の全国ネットワーク安全標準化技術委員会（TC260）は『ネットワーク安全標準化工作月報（2026年第6期）』を公表した。推奨性国家標準計画として『ネットワーク安全技術 人工知能コード生成サービス安全要求』や『ネットワーク安全技術 人工知能安全能力成熟度評価方法』などの3項目が下達された。また、推奨性国家標準草案『ネットワーク安全技術 人工知能技術関連未成年者応用安全指南』の意見募集（60日間）、および標準実践指南草案『人工知能応用安全指引 教育業界』『人工知能応用安全指引 衛生健康』の意見募集が実施された。",
    "so_what": "中国でAIサービスや特定分野向けAIを提供する企業は、技術・分野別の詳細な国家標準やガイドラインの策定動向に沿った適合評価とガバナンス構築が必要となる。",
    "impact": {
      "diff_changed": false,
      "diff_note": "EU AI Actが横断的なリスク分類に基づく法的義務を課すのに対し、中国はセクター別・技術別の国家標準および実践指南を個別に策定・運用するアプローチをとっている。"
    },
    "canonical_event": "Cybersecurity standardization monthly report published",
    "publication_date": "2026-07-21",
    "effective_date": null,
    "deadline_date": null,
    "sources": [
      "https://www.tc260.org.cn/portal/article/1/0efe73df0f234fa5a4fce766173b5678"
    ],
    "country_anchor": "/country/cn/#axis-risk_classification"
  },
  {
    "id": "2026-07-16-kh-001",
    "date": "2026-07-16",
    "country": "kh",
    "axis": "general",
    "change_type": "other",
    "legal_stage": "other",
    "title": "カンボジアが世界人工知能協力機構（WAICO）設立協定に署名",
    "summary": {
      "what": "世界人工知能協力機構（WAICO）の設立協定への署名",
      "who": "カンボジア郵政通信省（Chea Vandeth大臣）",
      "when_impact": "2026年7月16日の署名時点から"
    },
    "detail": "2026年7月16日、カンボジア郵政通信省のChea Vandeth大臣はカンボジア政府の承認を受け、世界人工知能協力機構（WAICO）の設立協定に署名した。本署名には29カ国の代表および国連事務総長等の国際機関代表が参加した。WAICOはAIのイノベーション・開発・展開・利用の促進、国際協力の拡大、AI格差の是正、ならびにAI関連リスクや課題の共同軽減を目的としている。",
    "so_what": "国際協力やAI格差是正を目的とした枠組みへの参加であり、企業に対する直接的な法的義務や規制の変更は直ちには生じない。",
    "impact": {
      "diff_changed": false,
      "diff_note": "国際協力枠組みへの署名に関する報道であり、ハードローによる義務付けを行うEU AI Act基準と比較した差分変更はない。"
    },
    "canonical_event": "Cambodia signs agreement on the establishment of the World Artificial Intelligence Cooperation Organization",
    "publication_date": "2026-07-16",
    "effective_date": null,
    "deadline_date": null,
    "sources": [
      "https://mptc.gov.kh/en/2026/07/minister-chea-vandeth-represents-cambodia-as-a-signatory-to-the-agreement-on-the-establishment-of-the-world-artificial-intelligence-cooperation-organization/"
    ],
    "country_anchor": "/country/kh/#axis-risk_classification"
  },
  {
    "id": "2026-07-23-kr-001",
    "date": "2026-07-23",
    "country": "kr",
    "axis": "penalties",
    "change_type": "other",
    "legal_stage": "other",
    "title": "韓国個人情報保護委員会、TikTokとAppleに計105億ウォン超の過徴金等処分",
    "summary": {
      "what": "TikTokの行動情報収集やAppleのSiriデータ利用等に対する制裁決定",
      "who": "韓国個人情報保護委員会（PIPC）、TikTok、Apple",
      "when_impact": "2026年7月22日の全体会議での決定以降"
    },
    "detail": "韓国の個人情報保護委員会は、2026年7月22日の第14回全体会議において、適法な根拠なく利用者の個人情報やSiri等のデータを収集・利用し国外出送したTikTokおよびAppleに対し、総額105億5,800万ウォンの過徴金算定および是正・公表命令を決定した。",
    "so_what": "AIサービスの改善や行動追跡に利用するデータについて、明示的な同意取得と国外出送手続の徹底が求められる。",
    "impact": {
      "diff_changed": false,
      "diff_note": ""
    },
    "canonical_event": "South Korea PIPC sanctions TikTok and Apple for unlawful personal information collection",
    "publication_date": "2026-07-23",
    "effective_date": null,
    "deadline_date": null,
    "sources": [
      "https://www.pipc.go.kr/np/cop/bbs/selectBoardArticle.do?bbsId=BS074&mCode=C020010000&nttId=12330"
    ],
    "country_anchor": "/country/kr/#axis-penalties"
  },
  {
    "id": "2026-07-22-kr-001",
    "date": "2026-07-22",
    "country": "kr",
    "axis": "general",
    "change_type": "guideline_draft",
    "legal_stage": "final_guidance",
    "title": "韓国個人情報保護委員会、「公共AXプライバシー保護ガイドライン」を公開",
    "summary": {
      "what": "公共部門のAI転換（AX）に向けたプライバシー保護ガイドラインの公表",
      "who": "韓国個人情報保護委員会（PIPC）および行政・公共機関",
      "when_impact": "2026年7月23日の公開時より"
    },
    "detail": "韓国の個人情報保護委員会（PIPC）は、公共部門のAI転換（AX）においてプライバシーを保護し安全な活用を推進するための「公共AXプライバシー保護ガイドライン」を公表した。本ガイドラインでは、事前設計・開発構築・適用管理の3段階における10大核心点検項目を整理するとともに、活用方式とリスクに応じて「基礎業務補助」「情報連携・分析・推薦」「選別・判断」の3タイプに区分し、差等化された安全対策を規定している。",
    "so_what": "韓国の公共分野向けにAIシステムを提供する企業は、活用タイプに応じた個人情報安全措置や10大点検項目への適合が求められる。",
    "impact": {
      "diff_changed": false,
      "diff_note": "韓国国内の公共部門における個人情報保護法遵守に関する実務ガイドラインであり、EU AI Actの規制構造への直接的な影響はない。"
    },
    "canonical_event": "South Korea public AI transition supported by privacy protection",
    "publication_date": "2026-07-22",
    "effective_date": null,
    "deadline_date": null,
    "sources": [
      "https://www.pipc.go.kr/np/cop/bbs/selectBoardArticle.do?bbsId=BS074&mCode=C020010000&nttId=12307"
    ],
    "country_anchor": "/country/kr/#axis-risk_classification"
  },
  {
    "id": "2026-07-23-kr-002",
    "date": "2026-07-23",
    "country": "kr",
    "axis": "general",
    "change_type": "guideline_draft",
    "legal_stage": "final_guidance",
    "title": "韓国政府、エージェンティックAIイニシアティブおよび公共AXプライバシー案内書を審議・議決",
    "summary": {
      "what": "エージェントAIの安全性指針策定や公共AXプライバシー案内書を決定。",
      "who": "韓国政府（過企情通部・個人情報保護委員会等）およびAI開発・導入事業者",
      "when_impact": "2026年7月23日の長官会議での議決以降、順次推進の見込み。"
    },
    "detail": "韓国政府は第11回科学技術関係長官会議を開催し、「エージェンティックAIイニシアティブ」および「公共AXプライバシー保護案内書」等を審議・議決した。エージェントAIの自律的実行に伴うリスクに対応するため、安全・信頼ガイドラインの策定、評価・検証基盤の構築、責任所在の検討を推進する。また、公共機関のAI転換（AX）における10大点検事項（適法根拠の確認、プライバシー設計、安全措置、透明性確保等）やリスク水準に応じた点検基準を提示した。",
    "so_what": "自律型エージェントAIを開発・提供する事業者や公共向けAXソリューションを扱う企業は、策定予定の安全・信頼性ガイドラインや個人情報点検基準への適合準備が必要となる。",
    "impact": {
      "diff_changed": false,
      "diff_note": "韓国国内におけるエージェント型AI施策および公共AIプライバシー指針の推進であり、EU AI Actとの規制アプローチ比較における差分影響はない。"
    },
    "canonical_event": "South Korea strategy for AI ecosystem development and growth",
    "publication_date": "2026-07-23",
    "effective_date": null,
    "deadline_date": null,
    "sources": [
      "https://www.pipc.go.kr/np/cop/bbs/selectBoardArticle.do?bbsId=BS074&mCode=C020010000&nttId=12308"
    ],
    "country_anchor": "/country/kr/#axis-risk_classification"
  },
  {
    "id": "2026-07-14-jp-001",
    "date": "2026-07-14",
    "country": "jp",
    "axis": "general",
    "change_type": "other",
    "legal_stage": "final_guidance",
    "title": "内閣府、人工知能基本計画の閣議決定・資料を公表",
    "summary": {
      "what": "人工知能基本計画の閣議決定および本文・概要の公表",
      "who": "日本政府（内閣府）、AI研究開発・活用事業者",
      "when_impact": "2026年7月14日閣議決定"
    },
    "detail": "内閣府は、令和8年（2026年）7月14日に閣議決定された「人工知能基本計画」の本文および概要資料（英訳含む）を公表した。",
    "so_what": "政府の新たなAI基本計画が決定されたため、今後の国の施策方針およびガイドライン等の動向確認が必要です。",
    "impact": {
      "diff_changed": false,
      "diff_note": "基本計画の公表であり、EU AI Actとの法規制差分（ソフトロー中心の枠組み）に直接的な変更は確認されない。"
    },
    "canonical_event": "Japan Artificial Intelligence Basic Plan Phase 2 adopted",
    "publication_date": "2026-07-14",
    "effective_date": "2026-07-14",
    "deadline_date": null,
    "sources": [
      "https://www8.cao.go.jp/cstp/ai/ai_plan/ai_plan.html"
    ],
    "country_anchor": "/country/jp/#axis-risk_classification"
  }
]
